{
  "$schema": "../../packages/shared-scene/schema/tour.schema.json",
  "id": "memphis-white-walls-early-kingdom",
  "title": "Ancient Memphis: A Walk Through the White Walls",
  "period": "Early Dynastic / Old Kingdom, anchored to Kom el-Fakhry and early Ptah precinct research",
  "location": "Memphis, Egypt",
  "durationSeconds": 210,
  "summary": "A compact living-history walk from the Nile edge through an inhabited Kom el-Fakhry / Mit Rahina anchored Memphis district toward an early Ptah precinct reconstruction.",
  "guidedRoute": {
    "id": "nile-arrival-to-ptah-precinct-route-v2",
    "label": "Play Route: Nile Arrival to Early Ptah Precinct",
    "notes": [
      "Dedicated autoplay route for the locked district placement. Story stops remain evidence/UI anchors; these waypoints keep the observer centered on walkable axes.",
      "The route uses orthogonal turns through the Nile landing, White Walls gate opening, Kom el-Fakhry-inspired residential street centerline, and Ptah precinct gate."
    ],
    "waypoints": [
      {
        "id": "boat-side-start",
        "position": [-36, 1.7, -52],
        "lookAt": [-23.2, 1.6, -52],
        "stopId": "nile-arrival"
      },
      {
        "id": "landing-straight-ahead",
        "position": [-23.2, 1.7, -52],
        "lookAt": [-23.2, 1.6, -42]
      },
      {
        "id": "turn-left-toward-white-walls",
        "position": [-23.2, 1.7, -38],
        "lookAt": [-23.2, 1.6, -32]
      },
      {
        "id": "white-walls-gate-center",
        "position": [-23.2, 1.7, -31.4],
        "lookAt": [-23.2, 1.6, -26],
        "stopId": "white-walls-threshold"
      },
      {
        "id": "inside-white-walls",
        "position": [-23.2, 1.7, -26],
        "lookAt": [-6, 1.6, -26]
      },
      {
        "id": "turn-right-after-gate",
        "position": [-6, 1.7, -26],
        "lookAt": [-6, 1.6, -18]
      },
      {
        "id": "hero-street-entry-center",
        "position": [-6, 1.7, -18],
        "lookAt": [-6, 1.6, -6],
        "stopId": "kom-el-fakhry-street"
      },
      {
        "id": "hero-street-mid-center",
        "position": [-6, 1.7, -4],
        "lookAt": [-6, 1.6, 12]
      },
      {
        "id": "hero-street-market-center",
        "position": [-6, 1.7, 16],
        "lookAt": [-6, 1.6, 30],
        "stopId": "craft-area"
      },
      {
        "id": "hero-street-exit-center",
        "position": [-6, 1.7, 34],
        "lookAt": [0, 1.6, 34]
      },
      {
        "id": "turn-toward-ptah-gate",
        "position": [0, 1.7, 34],
        "lookAt": [0, 1.6, 48]
      },
      {
        "id": "ptah-main-gate-center",
        "position": [0, 1.7, 49],
        "lookAt": [0, 1.6, 63],
        "stopId": "temple-exterior"
      },
      {
        "id": "ptah-outer-court-axis",
        "position": [0, 1.7, 68],
        "lookAt": [0, 1.6, 84]
      },
      {
        "id": "painted-shrine-axis",
        "position": [0, 1.7, 84],
        "lookAt": [0, 1.6, 96],
        "stopId": "painted-interior"
      }
    ]
  },
  "stops": [
    {
      "id": "nile-arrival",
      "title": "Nile Arrival",
      "summary": "The visitor begins beside a Nile branch or canal landing, with boats, reeds, mooring posts, storage jars, and the city edge ahead.",
      "evidenceLevel": "inferred",
      "position": [-30, 1.7, -50],
      "lookAt": [-45, 1.4, -52],
      "durationHintSeconds": 30,
      "referenceNotes": [
        "Nile access is essential to Memphis, but this exact landing and canal-edge composition is provisional."
      ]
    },
    {
      "id": "white-walls-threshold",
      "title": "White Walls Threshold",
      "evidenceLevel": "inferred",
      "summary": "A white-plastered mudbrick edge marks the transition from river infrastructure into the ancient city district.",
      "position": [-7, 1.7, -31],
      "lookAt": [-6, 1.6, -18],
      "durationHintSeconds": 25,
      "referenceNotes": [
        "The White Walls identity is historically important for Memphis, but the exact early city-wall placement and form remain debated."
      ]
    },
    {
      "id": "kom-el-fakhry-street",
      "title": "Kom el-Fakhry Street",
      "summary": "A narrow mudbrick residential lane uses clustered houses, plastered courtyards, storage bins, jars, and shade cloth.",
      "evidenceLevel": "inferred",
      "position": [-6, 1.7, -12],
      "lookAt": [-6, 1.6, 10],
      "durationHintSeconds": 35,
      "referenceNotes": [
        "Domestic architecture is inferred from Kom el-Fakhry / Memphite settlement archaeology and comparable period material culture."
      ]
    },
    {
      "id": "craft-area",
      "title": "Craftsmen Area",
      "summary": "Pottery, basketry, stone dressing, and low workshop structures connect the district to Memphis craft and temple economy.",
      "evidenceLevel": "inferred",
      "position": [-2, 1.7, 22],
      "lookAt": [2, 1.6, 42],
      "durationHintSeconds": 35,
      "referenceNotes": [
        "Craft activity is supported by Memphis/Ptah associations and workshop references, but this exact compact placement is reconstructed."
      ]
    },
    {
      "id": "temple-exterior",
      "title": "Early Ptah Precinct",
      "summary": "A walled sacred approach marks the transition from city life into the early Ptah / Hwt-ka-Ptah cult precinct.",
      "evidenceLevel": "inferred",
      "position": [0, 1.7, 49],
      "lookAt": [0, 1.6, 68],
      "durationHintSeconds": 40,
      "referenceNotes": [
        "The Temple of Ptah is the selected sacred anchor, but the Early Dynastic / Old Kingdom exterior form is inferred rather than directly preserved."
      ]
    },
    {
      "id": "painted-interior",
      "title": "Painted Ptah Shrine",
      "summary": "Painted walls, incense, ritual objects, and filtered light show a cinematic inner shrine reconstruction.",
      "evidenceLevel": "speculative",
      "position": [0, 1.7, 84],
      "lookAt": [0, 1.6, 96],
      "durationHintSeconds": 45,
      "referenceNotes": [
        "The interior is the emotional climax, but exact iconography and layout must remain speculative until source licensing and expert review."
      ]
    }
  ]
}
